{
  "schema_version": "module-content-candidates.v1",
  "status": "PRODUCT_OWNER_SUPPLEMENT_COMPLETE_PENDING_MODULE_OWNER_HASH_SIGNATURE",
  "release_target": "2026-09-01-production-canary-uat",
  "decision_source": {
    "source_id": "SRC-OWNER-03",
    "product_owner": "刘默文",
    "authorized_at": "2026-08-26T17:26:27Z",
    "decision": "AUTHORIZE_MINIMUM_P0_CONTENT_COMPLETION",
    "constraints": [
      "不伪造模块Owner本人签署",
      "不降低候选冻结、安全、恢复、真人UAT或发布Gate",
      "不执行生产作业或写入生产系统",
      "积分仅用于激励和参考",
      "AI仅做自查、初评和摘要，正式结论由真人签署"
    ]
  },
  "shared_reviewer_policy": {
    "pool_ref": "REVIEW-POOL-2026-09-01-P0",
    "primary_reviewers": [
      "万雨欣"
    ],
    "backup_reviewers": [
      "屠元琦"
    ],
    "weekly_capacity_people": 25,
    "capacity_scope": "每个滚动7日最多服务25名唯一学员；Canary 8人包含在内",
    "first_response_sla_minutes": 1440,
    "completion_sla_minutes": 2880,
    "revision_response_sla_minutes": 1440,
    "backup_triggers": [
      "分配后12小时内主Reviewer未接单",
      "提交后24小时内无首次反馈",
      "主Reviewer请假、失联或超过周容量",
      "主Reviewer与提交人或任务存在回避关系"
    ],
    "escalation_owner": "屠元琦",
    "final_escalation_owner": "刘默文",
    "independent_uat_witness": "冯宇汀",
    "separation_of_duties": "屠元琦不得同时成为同一任务的唯一Reviewer和唯一UAT签署人；申诉必须由未参与原结论的真人处理。"
  },
  "shared_data_policy": {
    "production_write_allowed": false,
    "raw_customer_data_allowed": false,
    "ai_high_impact_decision_allowed": false,
    "allowed_inputs": [
      "公开材料",
      "合成材料",
      "经批准的脱敏内部材料"
    ],
    "visibility": [
      "PERSON",
      "ASSIGNED_REVIEWERS",
      "AUTHORIZED_OPERATORS"
    ],
    "default_retention_days": 180,
    "production_execution_location": "JOURNEY_OUTSIDE_ONLY"
  },
  "modules": [
    {
      "module_key": "exploration-camp",
      "package_id": "exploration-camp-p0-2026-09-01",
      "version": "1.0.0-candidate",
      "module_owner": "郑田源",
      "owner_confirmation_state": "SOURCE_SCOPE_CONFIRMED_BY_OWNER_ATTESTATION",
      "owner_hash_signature_state": "PENDING_PERSONAL_HASH_ACCEPTANCE",
      "source_refs": [
        "SRC-OWNER-03",
        "SRC-EXP-01",
        "SRC-EXP-02",
        "SRC-EXP-03"
      ],
      "source_locators": [
        "https://zx6w57w0j34.feishu.cn/sheets/LpnOsAMGth34BVtzRdXcq96Unwh?sheet=2ogROw",
        "docs/baselines/construction-v1.0/02_模块分册/01_探索营_V1.0.md"
      ],
      "source_confirmation": "郑田源已确认目标Sheet包含三项实操及Rubric；最终候选Hash仍待郑田源本人签署。",
      "content_items": [
        {
          "content_id": "EXP-TREASURE-01",
          "sequence": 1,
          "title": "公司与 Muchener",
          "learner_question": "这是一家怎样的公司，我将如何协作？",
          "minimum_output": "认知确认与真实问题清单",
          "estimated_minutes": 20
        },
        {
          "content_id": "EXP-TREASURE-02",
          "sequence": 2,
          "title": "AI 数据行业与模型",
          "learner_question": "AI数据为何影响模型，质量和安全意味着什么？",
          "minimum_output": "概念判断与不确定项",
          "estimated_minutes": 25
        },
        {
          "content_id": "EXP-TREASURE-03",
          "sequence": 3,
          "title": "项目认知",
          "learner_question": "一个AI数据项目为何存在，角色、目标和风险是什么？",
          "minimum_output": "项目结构理解卡",
          "estimated_minutes": 25
        },
        {
          "content_id": "EXP-TREASURE-04",
          "sequence": 4,
          "title": "项目交付与组织适配",
          "learner_question": "交付如何协作、提报、返修和承担责任？",
          "minimum_output": "通用交付认知卡与风险确认",
          "estimated_minutes": 20
        }
      ],
      "tasks": [
        {
          "task_key": "EXP-P1",
          "title": "规则拆解",
          "purpose": "把一段工作规则拆成可执行、可提报且不会越过红线的判断结构。",
          "non_goals": [
            "背诵规则原文",
            "自行补写未知规则",
            "仅输出总分或结论"
          ],
          "inputs": [
            "获批的短规则或合成规则材料"
          ],
          "deliverables": [
            "目标",
            "判断维度",
            "红线",
            "例外",
            "不确定项",
            "需提报问题"
          ],
          "estimated_minutes": 30,
          "execution_environment": "SIMULATION",
          "rubric": {
            "rubric_id": "EXP-P1-R1",
            "dimensions": [
              "目标识别准确",
              "判断维度完整",
              "红线与不可做事项明确",
              "例外和不确定项分开",
              "提报对象和问题具体"
            ],
            "pass_rule": "五个维度至少四项满足，且红线识别不得失败；真人Reviewer必须写理由。",
            "revision_rule": "缺少必交字段、把猜测写成事实、遗漏安全红线或提报对象不明确时返工。",
            "human_decision_required": true
          },
          "reward_policy": {
            "points_after_human_pass": 10,
            "repeat_award_allowed": false,
            "talent_conclusion_effect": "NONE"
          }
        },
        {
          "task_key": "EXP-P2",
          "title": "模型回答判断",
          "purpose": "对同一Prompt的两个回答作出可解释判断，并保留无法判断和不确定性的空间。",
          "non_goals": [
            "凭个人偏好选答案",
            "把AI建议当作真人结论",
            "编造外部事实"
          ],
          "inputs": [
            "同一Prompt的A/B回答",
            "获批评价上下文"
          ],
          "deliverables": [
            "选择A、选择B或无法判断",
            "判断维度",
            "具体理由",
            "证据与对比",
            "不确定项"
          ],
          "estimated_minutes": 35,
          "execution_environment": "SIMULATION",
          "rubric": {
            "rubric_id": "EXP-P2-R1",
            "dimensions": [
              "事实和证据",
              "回答完整性",
              "指令遵循",
              "对比理由具体",
              "不确定性披露"
            ],
            "pass_rule": "至少覆盖最相关的三个维度，理由必须引用回答中的具体证据，且不得编造事实。",
            "revision_rule": "只有结论无证据、理由泛化、忽略关键指令或隐藏不确定性时返工。",
            "human_decision_required": true
          },
          "reward_policy": {
            "points_after_human_pass": 10,
            "repeat_award_allowed": false,
            "talent_conclusion_effect": "NONE"
          }
        },
        {
          "task_key": "EXP-P3",
          "title": "边界与问题提报",
          "purpose": "在数据、规则或协作异常中先控制风险，再把问题提报给正确的人。",
          "non_goals": [
            "未经授权继续执行",
            "把未知项当作事实",
            "越权替决策人下结论"
          ],
          "inputs": [
            "合成的数据、规则或协作异常情境"
          ],
          "deliverables": [
            "已知事实",
            "未知项",
            "潜在影响",
            "安全的临时处理建议",
            "停止线",
            "需谁裁决"
          ],
          "estimated_minutes": 30,
          "execution_environment": "SIMULATION",
          "rubric": {
            "rubric_id": "EXP-P3-R1",
            "dimensions": [
              "事实与未知项分离",
              "影响判断",
              "停止线",
              "临时处理不扩大风险",
              "裁决人和问题具体"
            ],
            "pass_rule": "停止线和安全临时处理两项必须满足，其余三个维度至少两项满足；真人Reviewer必须写理由。",
            "revision_rule": "继续执行高风险动作、未区分事实和猜测、无停止线或无裁决对象时返工。",
            "human_decision_required": true
          },
          "reward_policy": {
            "points_after_human_pass": 10,
            "repeat_award_allowed": false,
            "talent_conclusion_effect": "NONE"
          }
        }
      ],
      "module_policy": {
        "result_package": "PERSONAL_GROWTH_BASELINE",
        "allowed_next_stage_decisions": [
          "进入下一训练阶段",
          "补强后复测",
          "暂缓"
        ],
        "forbidden_interpretations": [
          "录用结论",
          "淘汰结论",
          "项目准入终判"
        ],
        "calibration_rule": "两名Reviewer对同一样例最多允许一个非安全维度差异；任何安全维度分歧必须进入Panel校准。"
      },
      "candidate_sha256": "1d9feb1672c847279c0b85cdc5a13ea9a9890d45cad4b223dd59ef2f05bbeb1c"
    },
    {
      "module_key": "newcomer-village",
      "package_id": "newcomer-village-p0-2026-09-01",
      "version": "1.0.0-candidate",
      "module_owner": "屠元琦",
      "owner_confirmation_state": "PRODUCT_OWNER_SUPPLEMENTED_FROM_VERIFIED_SOURCE",
      "owner_hash_signature_state": "PENDING_PERSONAL_HASH_ACCEPTANCE",
      "source_refs": [
        "SRC-OWNER-03",
        "SRC-NV-01",
        "SRC-NV-02"
      ],
      "source_locators": [
        "https://zx6w57w0j34.feishu.cn/wiki/Zz4awe7I8iW6Cokjhi0cg8UunLb",
        "docs/baselines/construction-v1.0/02_模块分册/02_沐晨新手村.md"
      ],
      "source_confirmation": "沿用Muchen Quest已验证任务闭环；首发仅选择两条已存在且已启用的模拟任务。",
      "content_items": [
        {
          "content_id": "NV-TASK-23",
          "sequence": 1,
          "title": "T+1 公司与行业初识卡",
          "source_task_id": "23",
          "estimated_minutes": 45
        },
        {
          "content_id": "NV-TASK-24",
          "sequence": 2,
          "title": "AI 数据交付关键词解释",
          "source_task_id": "24",
          "estimated_minutes": 40
        }
      ],
      "tasks": [
        {
          "task_key": "NV-T1-COMPANY-INDUSTRY-CARD",
          "title": "T+1 公司与行业初识卡",
          "purpose": "帮助新成员建立对沐晨业务、AI数据行业和自身协作方式的可核验基础认知。",
          "non_goals": [
            "考察记忆背诵",
            "形成录用或淘汰判断",
            "使用客户原始数据"
          ],
          "inputs": [
            "获批的公司介绍材料",
            "获批的行业基础材料"
          ],
          "deliverables": [
            "公司业务理解",
            "行业关键词",
            "三个仍不确定的问题",
            "已咨询对象",
            "下一步补充计划",
            "可访问的提交链接"
          ],
          "estimated_minutes": 45,
          "execution_environment": "SIMULATION",
          "rubric": {
            "rubric_id": "NV-T1-R1",
            "dimensions": [
              "业务理解准确",
              "行业概念可解释",
              "问题真实具体",
              "来源与咨询对象可追溯",
              "下一步行动可执行"
            ],
            "pass_rule": "五个维度至少四项满足，且不得出现明显虚构或敏感信息泄露。",
            "revision_rule": "只有口号、无来源、问题空泛、无法访问交付物或包含未经授权敏感信息时返工。",
            "human_decision_required": true
          },
          "reward_policy": {
            "points_after_human_pass": 10,
            "repeat_award_allowed": false,
            "correction_policy": "更正采用追加分录，不覆盖原积分事实。",
            "talent_conclusion_effect": "NONE"
          }
        },
        {
          "task_key": "NV-T2-AI-DELIVERY-GLOSSARY",
          "title": "AI 数据交付关键词解释",
          "purpose": "把AI数据交付中的常用词汇转化为能在具体项目情境中使用的共同语言。",
          "non_goals": [
            "复制百科定义",
            "堆砌过宽泛术语",